,date,text
845,2020-06-15,"Acompáñanos este jueves 18 de junio al webinar: “Ley de Protección al Empleo” que expondrá Felipe Leigh, Director Legal de Adecco Chile.

Solo debes confirmar tu participación contestando el siguiente formulario:
https://t.co/5C0RJ0jzCY https://t.co/AF9O7adPis"
846,2020-06-15,"Buenas, recurro a su buena voluntad, debido a la #COVID19 me quedé sin trabajo desde mayo, trabajaba como reponedor de supermercados aquí en Santiago de Chile , y estoy buscando trabajo, ya sea como reponedor, vendedor, cualquier empleo de teletrabajo, etc."
847,2020-06-15,#Entérate En 3 meses Aguascalientes perdió casi 13 mil empleos https://t.co/N6P3BUbZhg @INEGI_INFORMA revela que son 12 mil 740 las fuentes de empleo formales que se han perdido https://t.co/ZlcpadQsp4
848,2020-06-15,@ChileAtiende se puede prorrogar visa sujeta a contrato estando fuera de chile ? Debido a la pandemia no eh podido regresar a chile pero mi empleador me respalda y aun conservo mi empleo como hago ? Esta proxima a vencer y asi no me dejaran viajar a chile
849,2020-06-15,"@HeviaCorre @patricionavia @sergioulloa1 Señor, en Chile campea la cesantía y el empleo informal ¿Comprendes que para esa gente (40% de la población), no salir de su casa implica no comer y no pagar deudas?"
850,2020-06-15,"@JenryVoys @pfalconb @meganoticiascl ¿en serio? Claramente frente a una situación de desempleo, es preferible estar con tu familia que aca en chile solo. El desempleo viene por la cuarentena que obliga a cerrar algunos comercios. Por otro lado, algunos no tienen residencia y por ende no reciben beneficios."
851,2020-06-15,"Buscamos institución con experiencia en empleo en sector tecnológico con el fin de: 
✅elaborar encuesta
✅aplicar instrumento
✅sistematizar información 
✅entregar conclusiones sobre demanda de mujeres en área tecnológica en Chile
Hasta 17/06
Postula en https://t.co/qCrKZaO7k8 https://t.co/JhdQfD36u0"
852,2020-06-15,"@felipeharboe sugiero subir de 10 a 20% las compras regionales de empresas que trabajan con @EquipoJUNAEB y que @INDAP_Chile abra centros de acopio y compra. Apoyamos agricultura ,genera empleo y abastecimiento @FAOChile @uestatales @UTalca"
853,2020-06-15,"@AlephEdu Más importante aún en 1 año más chile va a estar todo ten en pobreza y desempleo, nadie se va a acordar del virus chino y TODA  la oposición va  a hablar de que nunca debimos cerrar todos los negocios por 4 meses. https://t.co/PpAV6yIKsZ"
854,2020-06-15,"Presidente @PDC_Chile, @fchahin: ""El acuerdo que alcanzamos es un buen acuerdo. Es un alivio a las familias, a las pymes, protección de empleo y reactivación económica"""
855,2020-06-29,"@adnradiochile Que lástima, ahí el desempleo y miseria se afianzaran en Chile, todo por la particular manquera que algunos tienen para buscar dignidad. Decadencia social, cultural, intelectual, moral y económica en Chile."
856,2020-06-29,"@IvanKirch22 @noventasforever @ziberiaI @JoanGar80740631 Chile? Ejemplo?? Estallido social durante buena parte del año pasado, toque de queda en más de 10 ciudades, desigualdad social y económica, abusos de poder y casos de corrupción, aumento de desempleo y pocos derechos sociales garantizados. Un éxito."
857,2020-06-29,"@ximerincon @estadonacional @TVN @24HorasTVN Y que sigue después que se hayan gastado el 10%?
Porque Chile ya se endeudó y no hay más recursos.
Esta Plandemia seguirá por lo menos 4 meses más...
Después que las personas se hayan gastado el 10%, de donde sacaran plata? Si no hay empleo, ni inversión?"
858,2020-06-29,El Blog de Benjita https://t.co/nRpTykcapc #Lunes #LunesDeGanarSeguidores #LunesDeCuarentena #Covid19Chile #FelizLunesATodos #coronaviruschile #Chile #desempleo #epidemia #pandemia #pandemiadedespidos #pandemiadementiras #epidemiadecorrupción #cesantia #LunesDeOjos #NoMasAfp
859,2020-06-29,"@matiaswalkerp @colmedchile @ElMercurio_cl @DiputadosDC @PDC_Chile Entonces hay q hacer lo q la oposición quiere, como ustedes son lo q dan empleo a la gente y si no le piden al gobierno q financie toda idea populista q debiera ser financiada con los impuestos d los q emprenden y/o trabajan. No he escuchado ninguna idea d cómo ayudar la economía"
860,2020-06-29,"@canal13 @mirkomacari @melnicksergio @baradit @AlbertoMayol @Jaime_Bassa Felicitarse x conseguir empleo a persona de 74 años sin criticar el hecho que debiera estar jubilado con dignidad, es ejemplo de la ceguera social en Chile.
Hay un sistema de ahorro buscamos un Sistema de Pensiones."
861,2020-06-29,"@GlendaUrd Acá el chile se hizo una ley en plena pandemia,ley protección al empleo,se pensaba que era para el trabajador pero era para proteger al empleador,despidieron mucha gente y suspendieron trabajos sin  goces de sueldo,esa ley es a la medida."
862,2020-06-29,"Publicación de #Datos Económicos para esta semana en Chile: Lunes Feriado; Martes, Producción de Cobre, datos de Manufacturas, Ventas Retail y Tasa de Desempleo; Miércoles, Actividad Económica. Más info visita: https://t.co/B3hJRqgjtN https://t.co/4IL5Y11gpJ"
863,2020-06-29,"@manuelbzr Desde que era niño he visto esto... y eso que ya tengo más de 30 años... Chile es el Edén de la “solución parche”. Tal como tú dices, esto estallará muy pronto; pandemia, desempleo, anegamientos, frío, cuadros respiratorios... es una bomba de tiempo"
864,2020-06-29,"Brillante: cuando se necesita reactivación, emprendimiento, empresa y empleo los viejos políticos que nos proponen: SUBIRNOS LOS IMPUESTOS !

Dos catástrofes históricas seguidas, una detrás de la otra golpean a Chile y estos huevones quieren apretar aún más a la gente. 
De locos https://t.co/J498DO63ON"
865,2020-06-29,"@Grachyelaa Por ejemplo te darias cuenta como maneja chile el tema de seguridad , o españa el tema de desempleo , o asiii. La expansion de la vision no se logra solo con estudios si no que tambien con experiencia compartida. Por eso las maestrias desarrolladas con otros gerentes.. (sigue)."
866,2020-06-29,"@ximerincon midieron el efecto de la medida? O es a lo Karol Cariola.....?
Esos fondos están invertidos en Chile, la liquidación será desinversión, por consecuencia más desempleo,  menor ingreso, menor recaudación en impuestos....finalmente más pobreza"
867,2020-06-29,"En medio de esta pandemia vemos desnudarse el verdadero Chile: el del empleo precario y la desigualdad, el Chile de la basura escondida bajo la alfombra, esa que pisa tanta gente indolente, con dinero, influencia pero poco talento.
 Chile necesita enfrentar su propia realidad."
868,2020-06-28,"@MarceTyS @DMatamala @cgarciado Todavía no entiendo una cosa... Si todo este desarrollo social que dejo la caga en el país y que hizo que muchos inversionistas se fueran del pais... Que pasaría si sale apruebo??? Chile quedaría en un estado económico donde solo verían desempleo, hambre, delincuencia y más..."
869,2020-06-28,"Chile lidera el número de fallecidos y el número de contagios. El sistena de salud colapsa, el desempleo es de 2 cifras y piñera no promulga leyes sociales. 9000 fallecidos y el criminal demente rompe cuarentena para comprar vino. Hasta cuando!!? #PiñeraBorracho https://t.co/u0vB767y3n"
870,2020-06-28,"@desenamorado3 @YoSoyOsoRijo La economía funciona así : el estado es pésimo generador de empleo, eso es burocracia. Son los particulares quienes generan empleo a través de sus empresas, pero deben ser rentables, un ROI mayor al que puedan lograr en Brasil México Perú o Chile, bajos impuestos, mano de obra$?"
871,2020-06-28,"@Toms43261941 @fglb21 @GONZADELAU @Roselen34732292 @mcubillossigall Tomas, has dado empleo? Le pagarías a un auxiliar como a un ingeniero? El mínimo es paupérrimo, pero creo que con estudios, esfuerzo y crecimiento Chile se levanta, saludos"
872,2020-06-28,"@jimespania @Andres17220855 @RodriguezManuel Crear mas empleo. Dar mas oportunidad a los Privados.....equilibrar  trabajo Privado  trabajo Estado..... Se trabaja en equipo.
ESO ES CORRECTO.  

Menos inmigrantes.
Sacar del pais a los  q no aportan.
Basta de  importar lo q no se necesita o a los que  delinquen..

Fuer d Chile"
873,2020-06-28,"El gobierno fiscaliza el teletrabajo, según ellos hay que proteger el empleo de los chilenos... Será que el Ministerio de la mujer de Chile no recibe los memos del presidente? Porque tienen sin empleo a 1200 personas"
874,2020-06-28,"@JuanaPr27332865 @melnicksergio Trabaje en una consultora de reclutamiento de personal, y es una verguenza el nivel de CESANTIA EN CHILE, DECENAS DE MILES DE PROFESIONALES SIN EMPLEO. Gracias a las maravillosas reformas tributarias y economicas de la guatona nefasta y a la complicidad del PERKIN DE PIÑERA."
875,2020-06-28,"¿Y no la funaron por #TráficoDePersonas desde Haití?¿No la funaron por destruir el empleo, la economía, subir los impuestos, reventar la educación pública y destrozar el #EstadoDeDerecho en Chile?¿No la funaron por el asilo a #Honecker?¿#Caval?¿#Odebrecht? 
#AllendeVivenEnMaduro https://t.co/9W00CnNo0m"
876,2020-06-28,"Cómo alguien puede pensar que hay un manejo razonable en Chile #COVID19 ?

Decenas de miles de muertos, gasto en salud de las familias, secuelas de salud, hambre, desempleo, quiebra pymes, caída económica monumental, sufrimiento social..

Era 1-2 meses de buenas medidas"
877,2020-06-28,"Me imagino que usted, encuentra digno que hubiera que hacer colas para conseguir algo de comida, que las empresas fueran tomadas, que el desempleo fuera altísimo.Chile entre 1970 y 1973 un 60% de la población era pobre eso es dignidad para usted @karolCariola usted es una 💩🤮 https://t.co/HBKtJ4aGh1"
878,2020-06-28,Buzo comercial certificado nacionalmente en Chile.. https://t.co/JSlbC38b6F #empleo #trabajo en Chillán
879,2020-06-28,"@Uva22 @AlfonzoFranco5 @CMonteroOficial @MPocay En Chile no se han perdido empleo por culpa de bloqueos. Y si hablas de Venezuela permítame decirte que Chávez expropió la empresa donde yo trabajaba, con el tiempo la empresa quebró y como esa muchas. 

Por último el bloqueo llegó con Trump, hace 2 años. Yo salí de vzla hace 6"
880,2020-06-28,@iallendebussi @Movilh @IgualesChile @danivega @pablosimonetti @rjimenez_perez @MUMS_Chile @acciongay @acciongayvalpo @grupojovenesG @AgrupalesbicaRS @claudiaamigo73 @SenadoresPS @PSChile @Senado_Chile @sebastian_gray @carlosmontestwt @_adrianamunoz @quinterosenador @Insulza @jplchile @adeurresti @alvaroelizalde @Bernicancino Búsquese un empleo decente vieja parásita y mantenida.
881,2020-06-28,"@melnicksergio Hagamos un esfuerzo por centrar la discusion en las ideas y no en las personas ni en los partidos politicos. Chile necesita avanzar en solucionar los problemas evidentes que afectan a la gente: salud, educación, empleo, seguridad, bienestar general. El modelo necesita ser revisad"
882,2020-06-28,"@chechimee @RetiredMaybe Al quitar las restricciones algunas de éstas personas desempleadas logró un empleo y otros retomaron su anterior empleo.Lo importante de esto es q un país no se puede parar. Voy al punto eres chileno y los de izquierda jodiendo en Chile,la lucha es no volver a la época de Allende https://t.co/VcHesemsh8"
883,2020-06-28,"@AtienzaCortes Porque no pidieron plebiscito primero para pedir si estamo de acuerdo que llegue mas gente,   ahí que oponerce ya, que  chile no es un basurero del mundo y que mande gente , primer debemos defender muestro país y lo pocos empleo que ahí"
884,2020-06-28,"@luisgentile8 @tomignzlz__ @Backup_83 @Miguel_Boggiano Dato mata relato, de Chile hablo: si te fijas en la tasa de desempleo, desocupación, pobreza, indigencia, PBI, inversión extranjera, educación, etc. Nos llevan una buena ventaja y tienen pocos recursos naturales, poca extensión de territorio y además tienen catástrofes climáticas"
885,2020-06-28,"@sebastianpinera @albertoespina @min_interior @GalliJF @katymartorell @mindefchile @Armada_Chile Arregla por favor la basura de ley de protección del empleo que promulgaste, puros abusos.

#RenunciaPiñera"
886,2020-06-28,"En @Cooperativa señalo que la urgencia que estamos viviendo no permite más errores y claramente, nos desafía a todos a concretar, en breve, un amplio acuerdo nacional, que defina una salida a la crisis para enfrentar la pobreza, el desempleo y el hambre. https://t.co/V74sO9T6GR"
887,2020-06-28,@florcahue @Mineduc @Senado_Chile @LehuedeJuan @cata_1910 @CcarvajalA2012 @Caroefi80 @gene_llerena No creo le paguen lo mismo por conectarse una hora o trabajar  9 horas presenciales. Que cobren su seguro de desempleo igual que muchísimos del sector privado.
888,2020-06-28,"Tasa de desempleo en Chile. Fácilmente podría llegar al 20%. ¿Llegaron los tiempos mejores? 
https://t.co/mhXgB2Grie"
889,2020-06-28,"@ferage @gioacchin_ La verdad que decis pavadas los derechos laborales existen en todos lados y donde son excesivos (como en argentina) se pagan con desempleo estructural y pobreza (como en argentina) xq nadie invierte. Fijate como va Chile y Uruguay en pobreza, mortandad infantil, y crecimiento..."
890,2020-06-28,"Chile tiene una oportunidad al ver la gestión de #jorgesharp en #Valparaíso. No es necesario mirar Venezuela. Valparaíso hoy es Destruccion, desempleo, pobreza, estado abultado, robo municipal, emprendimiento aplastado. Eso es la izquierda del FA, PC, PS, etc. #FueraComunistas"
891,2020-06-28,"@mcubillossigall El desempleo en chile venía subiendo antes del estallido social. 7.0% en agosto y eso que había bajado 0.1% según tu presidente, con 6.0 Bachelet no podía seguir gobernado. La pregunta es, la mala administración y los millones de pérdida, no aumentan la deuda?O la cosa es joder?"
892,2020-06-28,"Paulman es otro empresario líder en Chile que se expandió a toda América Latina, lo mismo Falabella liderada hoy por un joven de la familia que no pide ayuda estatal, mientras Paulman se acoja a la ley de protección del empleo, y luego se sale y luego paga dividendos...."
893,2020-06-28,"Para empleadores Mipymes, etc. de #Chile actualización de 22/06/2020 de Ley Nro.21.277 de Protección al Empleo, de la Dirección de Trabajo🇨🇱 @DirecDelTrabajo Dictamen Nro.1959/015 publicada 01/06/2020
#QuedateEnCasa 
#Covid19 #ChileEstaDeDuelo 
#28junio 
https://t.co/rsDFt4cOtS"
894,2020-06-28,"Allende destruyó Chile el peor presidente de la historia, inflación 600%,desempleo, pobreza hambre expropiaciones colas y la élite viviendo como reyes sus casas llenas de alimentos la gente haciendo colas para un kilo de azúcar, clases de guerrillas Castro metido en Chile,nefasto https://t.co/FZ8orNYoEC"
895,2020-06-28,"@mgjaquep Estos políticos todo lo “pudren” ..., ahora Techo para Chile es agencia de empleo para los hijos de políticos ... nunca más colaboración con esa institución!!!🤨"
896,2020-06-27,"@GastonPaulsokey @martintetaz Es el que te rompió el ojete: Latam hizo de Chile un país mejor dando oportunidades de empleo privado, no ñoquis o planes cómo acá. El resultado es ya conocido, te enteraste naboleti ? Quien va a pagar impuestos x pagar tu sueldo, bobina ?"
897,2020-06-27,"@ElMercurio_cl 
@ucatolica_chile 
@fenuchile 
@RFfrenchDavis 
Claro!! Los economista$ UC y el terror del desempleo! A destiempo, desafinado y lenguaje inapropiado para la
Música hoy; Chile requiere y se merece ideas con luces altas, las bajas son fáciles y convenientes para... 🎵 https://t.co/3pb5nNGzH5"
898,2020-06-27,"@eldesconcierto Nada de que sorprenderse, son parte de uno de los Chile, asegurados en sueldo y empleo a costa de los chilenos.Estos ineptos fueron enquistados en el estado pagando favores políticos y clientelismo.  Burócratas e ineficientes que incluso hacen la parodia."
899,2020-06-27,"Nada esta prohibido, lo q es muy feo es estar incitando a la gente a comprar donde le cobrarán el doble o el triple sabiendo la miseria q vive el pueblo d CHILE.
A Ud la llevaron obligada a la SUPER ley de protección empleo?
O no tiene problema en hacer pedido en cadenas ladronas https://t.co/u6ZEdycbNj"
900,2020-06-27,"En cambio en Chile, dijeron que NO era prioridad agrandar la Base Naval de Talcahuano para construir más y mejores barcos en el país! POSTERGADA una inversión estratégica que generaría empleo, capacidades, desarrollo, experiencia, infraestructura, equipamiento, etc. 🤔🤔🤔🤔🤔 https://t.co/z9GfssMj5C"
901,2020-06-27,Mi amigo el que está en Chile consiguió  un empleo.
902,2020-06-27,"Una reciente encuesta, elaborada por https://t.co/FZsTfn68Qp, reveló que en Chile el 30% de las personas en situación de discapacidad ha perdido su puesto de trabajo a causa de la pandemia. https://t.co/uibktm8sDB https://t.co/gMb5mBhT12"
903,2020-06-27,"@mgjaquep Mi hijo abogado con diplomados en Derecho Penal, Litigación,Derecho Sustantivo,com más de 5.000 audiencias,certificado en dominio inglés,Chile Compras, lleva 3 años cesante porque no soy diputada,¿algo q decir x el empleo de tu hija .@ximerincon?Sinvergüenzas las 2"
904,2020-06-27,@CPCchile @SNA_Chile @CamaraCChC @SofofaChile @Sonami_Chile @CamaraNacional @AbifChile Solo faltaría que aporten a mantener y producir empleo de calidad. Ahí sí los aplaudiríamos todos
905,2020-06-27,"@radiousach @marcoporchile Esta  es la propuesta más estupida,  propuesto por un drogadicto,  desempleado, corrupto .

INFIERNO , ESPERAME QUE VOY EN CAMINO.

CHILE EN CAMINO DE TENER LO QUE MERECE,  DELINCUENCIA , HAMBRE, DESEMPLEO Y FRIO.

QUE LA ISQUIERDA LES DE TRABAJO , DE COMIDA Y CALOR 

LAS GUEAS"
906,2020-06-27,"@Paola14178698 @Karen54465127 @NelsonG00203926 @DrEnriqueParis Las pymes generan el 40.6% del empleo .53.6%lo generan las grandes empresas, Conapyme indica que 850 mil pymes venden el 14% del total de ventas de chile VS 2000 mil megaempresas que venden 70% del total, si tu no ves un deslavace  la cifras de ventas , yo apunto a es desvalance."
907,2020-06-27,"@ad_ian_alvarado @ChumelTorres @martibatres @CONAPRED @FGRMexico @Infonavit No, yo solo debato con memes, ya ves que es la forma en que los atolizados AMLOVERS molleras sumidas ""debaten""

Jajaja debatir con memes, pobres pendejos.

En fin, ahora porque tanta defensa de tu chile #ElCacas ? 

Cómo defiendes la falta de empleo?
Empieza con esa pregunta."
908,2020-06-27,@mmlagoscc Hola @mmlagoscc  yo realicé catastro de ferias para el @meconomia  hace algunos años. Las ferias representan el principal canal de productos para  poblaciones de gse mas bajas y son una esponja del empleo en Chile. Para darse cuenta hay que vivir lejos del sector oriente. Saludos
909,2020-06-27,@HongoPor @patonietzsche @sangarciacorre Déjalo no más que se haga el piola el mugriento ese. Si siguen cerrando empresas el gobierno no lo va a ayudar y tendrá que travestirse para poder comer el hdp. Si viene a Chile y me pide empleo lo tengo a chuchadas (puteadas) apenas se quiera hacerse el canchero.
910,2020-06-27,"@mmlagoscc Bienvenida a Chile, ir a la feria no es una ""fiebre"" ya que muchos no se dan el ""gusto"" de ir al Super y pagar un 50% o más por lo mismo, no  se trata sólo de la ""frescura"". Explíquele a los compatriotas que están sin empleo o con contrato suspendido señora. Esta vez se equivoca."
911,2020-06-27,"@InarUldi @jbvaras @joseantoniokast Si esa es la definición, ojalá chile fuese más neoliberal y menos estatista
Creo que habría más empleo, más recaudación fiscal y menos despilfarro económico
Pero es muy amplio eso"
912,2020-06-27,"@camilaaguirre__ @SomosTodosMarco @alferdez A nivel mundial la economía cayó, incluso en países limítrofes como Brasil y Chile (donde aumentó a más de 20% el desempleo y siguen sin tomar medidas serias, aislando ALGUNAS CIUDADES SOLAMENTE), la diferencia con Argentina es que hay CIENTOS DE MILES DE CONTAGIOS ..."
913,2020-06-27,"Comisión legislativa aprueba informe con reformas al FEES: avanzan las políticas de privatización

#Chile #Despidos #desempleo #DerechosLaborales #LATAM 

https://t.co/F7HkOMdQK6"
914,2020-06-27,"DESPIDOS MASIVOS. Lamentablemente se está convirtiendo en algo común ver filas de trabajadores despedidos por las empresas, muchos de los cuales sin justificación. ¿Te tocó a tí?. Hagamos algo por tus derechos. #Despidos #empleo #abogados #trabajosíhay #Antofagasta #Chile https://t.co/xEyDy8yA1i"
915,2020-06-27,"FMI. Estimaciones de crecimiento para América Latina, evolución del empleo y ventas minoristas. Chile sería el país que menos caería en la región. Perú será la economía más golpeada con un descenso de 13,9% y descensos de un 10,5% México, 9,9% Argentina y 9,1% Brasil, Chile 7,5%. https://t.co/Vdc32V7j7V"
916,2020-06-27,"@josemdelpino @ministeriosalud Hemos vivido una mentira en cómodas cuotas, cuando se acabó el dinero y vino la ley de protección del empleo desnudó que casi todo Chile era pobre y sin derechos #YoApruebo #estadodemuerte #EstallidoSocial Para que nunca más las personas sin derechos fundamentales."
917,2020-06-27,"Álvaro Noboa ama a todo 🇪🇨 y también comparte con ellos el sueño de convertir al Ecuador en un imperio de riqueza,donde haya empleo para todos,donde los pobres lleguen a vivir como vive la clase media de Chile y otros países desarrollados,y donde reine Dios en nuestros corazones."
918,2020-06-27,"@pamitazavala @MChilenidad Patriotismo es crear empleo, oportunidades, mejorar salarios. Los paises prosperan cuando hay inversion, hay que atraer inversionistas a Chile con un programa de incentivos en rebaja de impuestos."
919,2020-06-27,"Hoy alrededor del mundo se celebra el Día de las Micro, Pequeñas y Medianas Empresas. Empresas, aquellas generadoras de empleo y grandes sostenedores de la economía mundial, #HaciendoComunidad día a día. ¡Felicidades! #ChileCompetente #PYMES #Chile #Emprendimiento #Emprendedores https://t.co/3B20zG5xtE"
920,2020-06-27,"@MadrugadoraMD @EzequielGC11 @fabriCL @mcastro212221 @gabyfernanda1 @MashiRafael Si el costo de producción y el circulante, el salario mínimo , por eso el énfasis en la producción local para generar empleo. Producir aquí para vender donde Colombia, Perú,Chile Bolivia o Europa etc etc ????. Es díficil el dólar es muy competitivo. Pero no es imposible."
921,2020-06-27,#Barrios @AChMChile @sebastianpinera #BALINES #OJOS #DEMOCRACIA #DIGNIDAD #PANDEMIA #CESANTIA #DESEMPLEO #PYMES #POSNATAL #CIFRAS #MENTIRAS #COLAS #CAJAS #BONOS #BANCOESTADO #FUNERAL #PROTOCOLOS . Las personas no son tratadas con dignidad y respeto por la clase politica de Chile. https://t.co/wpC20xNd7z
922,2020-06-27,"@tomashirsch Pero que caso de éxito!! El mejor Chile de la historia bajo este presidente, bonanza total en el país, pleno empleo, sobraba la comida, supermercados rebosantes de productos, libertad total para todos.... pobres progres ciegos con su patética ideología del fracaso...."
923,2020-06-27,"@RodriguezManuel @tomashirsch Exacto, fue en tremendo éxito!! Llevó a Chile a su mejor momento!! Había abundancia de todo tipo, el país estaba feliz, había pleno empleo, sobraba ma comida, supermercados rebosantes de productos, un sueño hecho realidad!!!! Jajajajjaa"
924,2020-06-27,@camila_vallejo La mitad de chile con pacto de protección al empleo y ellos recibiendo el@sueldo completiiiiito!!! Hay fondos!!! Pero son privados! Cómo los tuyos o los de tu amado PC! Esos no se tocan o si!????
925,2020-06-27,"@alexagomez2000 Es normal q regresen a su país,q vengan de Colombia Chile,etc pues por Covid19, quedaron sin empleo,no tenían como vivir,pagar arriendo etc, igual los q están en otro lugar regresan a su país de origen tienen derecho ."
926,2020-06-27,"@sebastianpinera @albertoespina @min_interior @GalliJF @katymartorell @mindefchile @Armada_Chile Unidos?... Quedaron compatriotas cesantes o acogidos a una ley que no proteje el empleo, las madres en Postnatal  aun desprotegidas, los familiares de fallecidos por covid con suerte tienes 10 minutos de para despedirse..  Nunca habra unidad mientras estes de presidente!!!"
927,2020-06-27,@ccifuentesh No estoy tan claro. Existirá un Chile y un mundo que permita a quienes tienen 60 o + años encontrar empleo en el mercado formal? Llegar a los 65 con un empleo formal hoy es una hazaña. Si no existe una profunda reformulación de la legislación laboral creo es peligrosa fórmula
928,2020-06-27,"@reacchi @puppyL_V 😑 Mientras ellos se tomaban esa foto en Chile había gente sufriendo por hambre, inflación en el comercio y desempleo... pero claro, los ignorantes lo ven como el weón que salvó Chile culpando a Mi General  que nos salvó de la mierda misma en la que estaba sumido el país 🤦‍♀️😑"
929,2020-06-27,"@Vane_vlfc @ValdiviaVICTOR6 @jisamit El desempleo en chile solo siguió su cause normal anterior al 18 OCT había un 6.7% de cesantía, y post 18 OCT la cifra alcanzó un 7.0% que estaba dentro de la proyección ya que cientos de empresas venían quebrando antes del 18 Oct"
930,2020-06-26,"@sergioulloa1 Sin ser vidente veo un futuro negro para Chile.

- Aumento de la pobreza a 20% a 2021
- Desempleo en niveles nunca antes vistos (20 o 30%)
- Baja de la inversión
- Aumento populismo izquierda
- Posible cambio en las reglas del juego
- Añoranza al Chile pre 18-O
- Mayor violencia"
931,2020-06-26,"@sebastianpinera @albertoespina @min_interior @GalliJF @katymartorell @mindefchile @Armada_Chile Recuerdo cuando recién eras candidato a tu primer gobierno, y en la micro una señora que se veía muy pobre le decía a sus hijos que iba a votar por ti porque nos traerías riquezas por ser rico tú: al final solo nos has traído muerte, corrupción, hambre, violencia y desempleo."
932,2020-06-26,"@Senado_Chile @Senado_Chile las medipresentadas son pan para hoy y hambre para mañana. *Muchas estamos mal Psicológicamente !!!
*Muchas no tienen fondos en el segurode cesantia!!!
*muchas tememos ser despedidas al acogernos a la ley protección del empleo!!
#postnataldeemergencia"
