,date,favorite_count,id_str,retweet_count,text
101,2020-07-17,,,,"@marceloclap @JorgeSharp @DrEnriqueParis En todo el mundo es igual, rebrotes, nuevos contagios, pero en todas partes ya se acabó la cuarentena: En Perú, Argentina, Brasil, etc...Somos los únicos weones en cuarentena y con muertes por otras causas, con la delincuencia desatada, desempleo de 20% #NoMasCuarentenaChile"
102,2020-07-17,,,,"What, pero si las plataformas de reparto no los reconocen como trabajadores. Ese servicio de delivery es informal y al no existir vinculo laboral, los repartidores quedan desprotegidos. El @MTPE_Peru normalizando la precarización del empleo. https://t.co/KTavEkQO5T"
103,2020-07-17,,,,"🤔 ¿Conoces nuestro programa social #TrabajaPerú?

🇵🇪 ¡Empleo temporal para quienes más lo necesitan! https://t.co/uAI4ukw9Bx"
104,2020-07-17,,,,"🤔 ¿Conoces nuestro programa social #TrabajaPerú?

🇵🇪 ¡Empleo temporal para quienes más lo necesitan! https://t.co/PFv6jQCxSr"
105,2020-07-17,,,,"🤔 ¿Conoces nuestro programa social #TrabajaPerú?

🇵🇪 ¡Empleo temporal para quienes más lo necesitan! https://t.co/nxYrURVxhE"
106,2020-07-17,,,,"🤔 ¿Conoces nuestro programa social #TrabajaPerú?

🇵🇪 ¡Empleo temporal para quienes más lo necesitan! https://t.co/xiAtiuRJzX"
107,2020-07-17,,,,@mihaza9700 @Manifiesto_Peru Pero no a una Secretaria General de la PCM escogida porque es novia de Carvallo quien es periodista de RPP. Por eso RPP y Canal N son solo aplausos al Gob.. Y a un ministro de trabajo que no sabe ni como es un documento de gestión pública.Crece el desempleo y pones a tu amiguito.
108,2020-07-17,,,,"@esquinabaja Peru se hunde en muertes, desempleo. Vizcarra endeudo al Peru con 11 mil millones de dolares, la económia se hundió en 40.49% (mayo) la tasa de desempleo se elevo en 16,3 la mas alta de america https://t.co/nGVViMczlM @MartinVizcarraC mejor renuncia por el bien del Peru. https://t.co/mWgOuVRcAO"
109,2020-07-17,,,,"DE LA LUZ VERDE A LA LUZ PROPIA
Las luces y sombras del nuevo Premier

Continuar leyendo: https://t.co/Ag0IA15sRS

#LampadiaAnalisis #luces #sombras #gobierno #pandemia #economía #crisissanitaria #trabajo #empleo #aprismo #fujimorismo #Congreso #Perú https://t.co/ovucSdcprh"
110,2020-07-17,,,,"Perú registra aumento récord de 16,3% en desempleo durante confinamiento por pandemia https://t.co/oZUuoQQTCz"
111,2020-07-17,,,,Minería en Perú recupera niveles de producción y generación de empleo por reanudación de actividades https://t.co/IEoBd8hkqK
112,2020-07-17,,,,"Infobae | Desempleo récord de 16,3% en Perú durante confinamiento por pandemia https://t.co/dwSjfQYw2J https://t.co/ssBGiSHxNw"
113,2020-07-17,,,,"@martinruggiero3 @MartinVizcarraC @MTPE_Peru Deben sacarlo del ministerio, osea que a los cholos no va a darnos empleo, porque olemos a queso. 😠"
114,2020-07-17,,,,"@patriciagamarra En el @MTPE_Peru para está situación de pandemia con tanta gente perdiendo el empleo se requería alguien con experiencia en el sector trabajo , va a ser una etapa de bastante conflicto social y el ministro d trabajo ideal es el que juegue del lado de la justicia,no del lucro."
115,2020-07-17,,,,"Al 7 de julio, el Ministerio d Trabajo recibió 30k solicitudes para suspensión perfecta, atendiendo &lt;30%. Pero lo retos además se extienden a generar nuevas plazas y evitar mayor informalidad.

Mi informa de hoy. [Suscriptores]

https://t.co/Y6Neay5Ht9 vía @elcomercio_peru"
116,2020-07-17,,,,"@Gestionpe Basta de subsidios, deben generar empleo, inversión, poner a gente a trabajar! Quieren hacer del #Perú una república bananera! @bbcmundo"
117,2020-07-17,,,,"@esquinabaja  El cartel moqueguano y la mafia nacionalis en panico y atacan desde el Troll center de la pcm. Mientras el Peru  mas muertes, desempleo, recesion y peor siguen los familiares del @MartinVizcarraC  Presidente encargado siguen haciendo de las suyas."
118,2020-07-17,,,,"#VenezuelaMigrante Un informe del Cepaz y Care Perú contempla que el 48% de las mujeres enfrentan barreras para cubrir las necesidades de empleo, salud, educación y seguridad social por su condición migratoria irregular https://t.co/21m3rdG540"
119,2020-07-17,,,,"""Cuando la desigualdad era mayor, la servidumbre doméstica estaba más extendida, mientras que hoy, felizmente, tiende a reducirse"".
C.c. @szegarram 
Los empleos que el tiempo se llevó, por Carlos Contreras Carranza https://t.co/WWE0VCtEtB vía @elcomercio_peru"
120,2020-07-17,,,,"El medicamento no se vende en el Perú y su valor comercial por 90 píldoras es de 27,000 USD qué como es lógico es imposible afrontar para una familia que ha perdido el empleo.
Les ruego por favor me ayuden compartiendo este post para que @Avianca se digne a dar la cara"
121,2020-07-17,,,,"@txemo @JoseLuisGil1000 Se hace necesario impulsar la agricultura campesina poner la ciencia y tecnología a su servicio. Genera empleo y abastece el mercado interno de alimentos ahorrando divisas al Peru. Y no recibe bonos, ni subsidios ni beneficios tributarios."
122,2020-07-17,,,,"@GustavoArana20 No solo para ser Ministro, esa es la realidad de conseguir un buen empleo en el Perú.
No importa cuan competente seas para un cargo siempre lo conseguirá alguien más por diversas razones."
123,2020-07-17,,,,"🎙️Director General de Mercados Financieros y Previsional Privado del MEF, Óscar Graham: La mejor forma de recuperar el empleo es mantener a las empresas operativas porque son las que generan puestos de trabajo. Hoy se han emitido las primeras 45 mil garantías de #Reactiva2."
124,2020-07-17,,,,Engañaste al Perú DICTADOR. Destruiste la economía y millones sin empleo y mueren de hambre. Ahora dices que no puedes controlar COVID-19?. RENUNCIA A PALACIO FRACASADO GOBERNANTE!!!. https://t.co/UCwhUfMGY0
125,2020-07-17,,,,"➡Minería en el Perú recupera los niveles de producción y generación de empleo https://t.co/Amu8SWRu4u 

Ministerio de Energía y Minas afirma que con la Fase 3 de la reanudación de actividades se han reactivado todos los estratos del sector minero

✍Por Christian Ninahuanca https://t.co/1nVOlboy1S"
126,2020-07-17,,,,"Con la finalidad de generar empleo temporal, el programa Trabaja Perú, ha proyectado 2 obras en el distrito de San Cristóbal y 2 en Lloque, informó el jefe zonal de Moqu...
https://t.co/LzXAIjGa7M"
127,2020-07-17,,,,"Editorial de El Comercio: Los ministros y los desempleados:
“En el Perú, para promover la creación de empleo formal se deben primero romper los paradigmas que nos han atado a la informalidad masiva por décadas”.  https://t.co/ZnA4VggJyx"
128,2020-07-17,,,,"Martín Ruggiero al mando del MTPE: expertos explican los retos más urgentes del sector Trabajo (Por @ricardoguerrab)

📰 Contenido solo para suscriptores de El Comercio. Suscríbete aquí para leer más informes ► https://t.co/TtRaz5zCUm

https://t.co/NLGQkfR2ZH"
129,2020-07-17,,,,"Q le pasa a Vizcarra diciendo Esto? Entonces por q nos encerró 3meses,empobrecio al Perú, dejó a tanta gente sin empleo, si todos nos vamos a infectar y morir? Q clase d INEPTO es y así dicen q tiene tanta aprobación. UNA PENA HABER CAÍDO EN MANOS D ESTE TIPO.
Y o hacemos Nada. https://t.co/4jkZn2Vgji"
130,2020-07-17,,,,"COMPATRIOTAS PERUANOS, EN ESTOS MOMENTOS EXISTE MAS DE 2 MILLONES DE JÓVENES QUE HAN PERDIDO SU TRABAJO, LA CONSTITUCIÓN POLÍTICA DEL PERÚ 🇵🇪, SEÑALA QUE EL ESTADO FOMENTA EL EMPLEO A TRAVÉS DEL MINISTERIO DE TRABAJO, PARA ESO EL MINISTRO DEBE TENER UN PERFIL CONCILIADOR CREATICO https://t.co/r2mVABaJ52"
131,2020-07-17,,,,"Mitad de limeños perdieron su trabajo.
Reactivar el empleo es posible, proyectos mineros encarpetados y construcciones de infraestructura son 70 veces más convenientes que programa Arranca Perú.
#COVID19 #arrancaperu https://t.co/SCYB4xUKZn"
132,2020-07-17,,,,@ToniAlvaL @MartinVizcarraC @PCaterianoB @ToniAlvaL  se  estima que el desempleo en el mundo será hasta un  14% el Perú como va hacer frente a esta crisis y usted como ministra de Economía que medidas va a tomar para enfrentar esta deflación  ?
133,2020-07-17,,,,@Minsa_Peru @victorzamora El ministerio de salud como agencia de empleo para comunistas mata sanos.
134,2020-07-17,,,,@arturoayala_4 Para mejorar a los de abajo hay que generar trabajo formal. Acabar con lo que ha perpetuado la informalidad y la falta de creación masiva de empleo en el Perú. La gente es informal porque los costos superan a los beneficios en el corto plazo y eso debe acabar
135,2020-07-17,,,,"POR FIN podemos acceder rápidamente a los proyectos de inversión pública financiados con transferencias por canon y regalías mineras, con la Plataforma #MapaInversiones Perú País Minero, además de la producción y empleo minero https://t.co/Gh23loh3zF
@MinemPeru @el_BID  @EITIorg https://t.co/WmGCQHohOc"
136,2020-07-17,,,,"@FunFavst En mi Perú ustedes y tengo data de eso AUMENTARON la delincuencia e informalidad. También la mendicidad, desempleo y hasta prostitución."
137,2020-07-16,,,,@canalN_ Ese señor que se dedique a curar enfermos que no moleste la economia está  destruida nunca pensé ver 2 millones de personas sin empleo gracias @MEF_Peru  gracias muchísimas gracias bestias
138,2020-07-16,,,,No aprovechamos el Boom para diversificar. 71% del crecimiento de exportaciones fue explicado por los productos tradicionales. La transformación productiva no sera automática. Los sectores mas productivos no dan empleo en el sector urbano. #economia #arrancaperú #Peru https://t.co/PKqfQjyQGH
139,2020-07-16,,,,"La realidad es el fin de toda tesis, de toda demagogia y de todo anhelo.

PBI de Perú cayó en 32.8%

Desempleo en Lima cayó en 55.1% en el trimestre abril, mayo y junio 2020

Fuente: instituto nacional de estadística e informática https://t.co/wzk7lU6D6L"
140,2020-07-16,,,,"Mientras el desempleo en países vecinos como Colombia, Perú y Argentina se mantuvo en 2018 en un solo dígito, con 9,7, 6,7 y 9,2%, respectivamente."
141,2020-07-16,,,,@manuelsalas @canalN_ @MTPE_Peru Me preocupa la base económica del Ministro. Con la alta informalidad laboral del Perú hacen faltas medidas económicas e incentivos que paulatinamente se cree empleo formal a la vez que el empleo como un todo aumenta. El foco en educación enfocada al aumento de productividad
142,2020-07-16,,,,"#HomeOffice #Empleable

Management &amp; Empleo: Home Office: Cinco formas de poner límites cuando se trabaja desde cas | NOTICIAS GESTIÓN PERÚ https://t.co/C6wNKJdOkH"
143,2020-07-16,,,,@martinruggiero3 @MartinVizcarraC @MTPE_Peru Creo que debemos dejarlo Trabajar y que vea por los trabajadores que nos quedamos sin empleo y nuestra cts que supuestamente sirve para eso.... Para cuando nos quedamos desempleados por lo menos que lo liberen el 100% para poder disponer de nuestro dinero lo necesitamos ahora
144,2020-07-16,,,,"7. El desempleo, en tanto, se ubicará a finales de año alrededor del 13,5%, lo que supone una revisión al alza de dos puntos con respecto al informe presentado por la Cepal en abril y de 5,4 puntos si se lo compara con el año pasado. https://t.co/NEK71zcgGa https://t.co/4CUFWsPfTF"
145,2020-07-16,,,,"4. El impacto sobre la actividad se trasladará a otros indicadores. “Se prevé ahora un aumento también mayor del desempleo, que a su vez provocará un deterioro importante en los niveles de pobreza y desigualdad”. https://t.co/NEK71zcgGa https://t.co/vSwdeO50cC"
146,2020-07-16,,,,"@elcomercio_peru pueblo quiere pan y empleo y no piensa en elecciones,los que piensan en elecciones son los parásitos politicos que al ser elegidos y se vuelven comechados y se olvidan de sus electores."
147,2020-07-16,,,,@martinruggiero3 @MartinVizcarraC @MTPE_Peru @MartinVizcarraC @PCaterianoB. Inexplicable ... La elección del Ministro del Empleo.
148,2020-07-16,,,,Me encuentro reunido con gremios MYPE de todo el Perú 🇵🇪 junto a congresistas representantes de @BancadaAPP @ApBancada @BancadaMorada @FrepapBancada @BankadaFP @podemosperu La Reactivación MYPE para generar empleo #NosUne @congresoperu
149,2020-07-16,,,,"hay que tomarle la palabra a @PCaterianoB cuando dice que la elección del ministro de trabajo es un mensaje político. Se viene la flexibilización laboral bajo el argumento del ""destrabe"" https://t.co/ReKal9fIRo"
150,2020-07-16,,,,"@LuisValdezF Fui víctima de despido arbitrarios,por los empleados de tv peru canal 7 todo por denunciar sus actos de corrupcion, y las entedidades donde denuncie me dieron la espalda ahora estoy sin empleó alguno con familia que mantener."
151,2020-07-16,,,,"@felixroj @Minsa_Peru @Agencia_Andina @DiarioElPeruano @noticias_tvperu @RadioNacionalFM Puedo soportar cualquier cosa, pero tu fealdad @warneriusko o @alexandro0953 es algo que no aguanto. ¡Put@ M@re eres más feo que el Coronavirus y el desempleo juntos!"
152,2020-07-16,,,,"@IsamarApruebo Ese es Chile!! Todavía se ocupan .
Entre Perú , Bolivia ; Chile no es muy distinto..Pobre , mala educación, mala salud , mal transporte público, desempleo estructural , sin valor agregado a sus recursos naturales, somos iguales.."
153,2020-07-16,,,,Situación #Perú. Tercer Trim. 2020 https://t.co/qeFtP2tvn7 vía @BBVAResearch Contracción del PIB de -15% este año; rebote de 8% en 2021. La recuperación del PIB y del empleo requiere evitar iniciativas que eleven la incertidumbre e introduzcan más cautela en el sector privado. https://t.co/cUscvjOBzB
154,2020-07-16,,,,@vozdelatierra @RPPNoticias @CONFIEP @MTPE_Peru @MinemPeru @MEF_Peru Ojala sea el escudero de las empresas que pagan impuestos y generan empleo y no de comunistas retrógados que  son los culpables de la pobreza en el mundo.
155,2020-07-16,,,,"@Anon_Wolfs @Minsa_Peru @Agencia_Andina @DiarioElPeruano @noticias_tvperu @RadioNacionalFM @julianaoxenford Argentina no tiene ni la mitad de Reservas Internacionales que tiene el Peru.
Esta sobre-endeudado, cosa que no es el caso de Peru.
Tenemos un dolar libre que casi no a variado en toda esta cuarentena.
Lo cierto que la pobreza a aumentado, ni que decir el empleo formal
#SigridPE"
156,2020-07-16,,,,"🔴 #TrabajaPorTuDistrito

La Municipalidad de Los Olivos y Trabaja Perú  te dan la posibilidad de contar con un empleo, participando en la ejecución de actividades de intervención inmediata, para mejorar el distrito. https://t.co/ChgoHPPa7z"
157,2020-07-16,,,,"Las políticas laborales que implemente el Gobierno deben atender especialmente a la mype pues concentra a la mayor parte de la PEA. Pero eso no es todo, deben destrabarse inversiones privadas, incrementarse las inversiones públicas…https://t.co/0lobnH8kci https://t.co/ZiUOVDMmlE"
158,2020-07-16,,,,"@MTPE_Peru Martin Adolfo Rugiero Garzon, lea las siguientes expresiones tuyos, lamentable no estas calificado para ocupar el cargo de Ministro de Trabajo y Promocion de Empleo, estas despedido.  https://t.co/G39HGeBFw5"
159,2020-07-16,,,,"@canalN_ Ingenieros que opinan como Medicos epidemiologos, bachilleres de ministros,  secretario luz verde de premier, cuñados, concuñados, R Swing con millonarios contratos en el ejecutivo y el pueblo se muere por el covid y el desempleo..El Peru avanza segun Vizcarra @KarlaCalle"
160,2020-07-16,,,,"🔔 ¡En 1h! vía #Zoom y #FacebookLive, no se pierdan el #DiálogoLibre: Inversión y recursos naturales ¿apoyo o indiferencia?, donde hablaremos sobre el efecto de las inversiones en la generación de empleo, ahorro y otros efectos.
👉Inscríbete aquí: https://t.co/XaVrSuk994 https://t.co/edSjpyRkvH"
161,2020-07-16,,,,"Y ahora con el ministro pulpin que haremos? Empleo por los suelos, seguiremos dando dinero con el cuento de #ReactivaPerú a empresas de @CONFIEP que no respetan al trabajador @cgt_peru @MTPE_Peru @pcmperu @MartinVizcarraC https://t.co/QAV893RyRW"
162,2020-07-16,,,,"Más de 2.6 millones perdieron su empleo por la pandemia, asegura @INEI_oficial https://t.co/pI1fWA6L7F https://t.co/xX2xthrNbj"
163,2020-07-16,,,,"La realidad es el fin de toda tesis, de toda demagogia y de todo anhelo.

PBI de Perú cayó en 32.8%

Desempleo en Lima cayó en 55.1% en el trimestre abril, mayo y junio 2020

Fuente: instituto nacional de estadística e informática https://t.co/Z9Vb4tUdkZ"
164,2020-07-16,,,,"Vital para salir de la crisis y generar empleo asap... 
 https://t.co/5FF7gkRSMN"
165,2020-07-16,,,,"Perú: Cateriano: La prioridad es destrabar inversiones para generar empleo, | NOTICIAS GESTIÓN PERÚ https://t.co/1TI8fkzgw6"
166,2020-07-16,,,,"@Killari227 @MTPE_Peru Es hora de sentarse a discutir una nueva ley del trabajo, que este a la altura de las actuales circunstancias, que estimule el empleo, y acabe con la informalidad laboral que es el principal problema que tiene el Perú. #Nuevaleylaboral https://t.co/OC0H0v7E5b"
167,2020-07-16,,,,"@RichardMontoyaR Es hora de sentarse a discutir una nueva ley del trabajo, que este a la altura de las actuales circunstancias, que estimule el empleo, y acabe con la informalidad laboral que es el principal problema que tiene el Perú. #Nuevaleylaboral https://t.co/OC0H0v7E5b"
168,2020-07-16,,,,"@alvaromns Es hora de sentarse a discutir una nueva ley del trabajo, que este a la altura de las actuales circunstancias, que estimule el empleo, y acabe con la informalidad laboral que es el principal problema que tiene el Perú. #Nuevaleylaboral https://t.co/OC0H0v7E5b"
169,2020-07-16,,,,"@MTPE_Peru @Minsa_Peru @pcmperu Es hora de sentarse a discutir una nueva ley del trabajo, que este a la altura de las actuales circunstancias, que estimule el empleo. https://t.co/OC0H0v7E5b"
170,2020-07-16,,,,"Mi solidaridad con #MartínRuggiero, ministro de trabajo y promoción del empleo del Perú. El no tiene la culpa de ser wbón, ni que su propio entorno lo haya puesto en evidencia."
171,2020-07-16,,,,"@OITAndina ha sido y será la mejor “escuela” para quienes, tercamente, apostamos por el entendimiento en las relaciones laborales. Gracias por el acompañamiento técnico y valiosa contribución para avanzar  en el Perú, hacia un sistema con empleo pleno, digno y productivo (AN XIV) https://t.co/9cU2NWltei"
172,2020-07-16,,,,"Un problema en la historia del Perú es el Estado como fuente de empleo. Mis propios colegas médicos ven, hasta ahora, al Estado como lugar de trabajo seguro. https://t.co/OI4O6sB2yN"
173,2020-07-16,,,,"@JA_Peru tiene su razón en el desafío que representa actualmente en el Perú el desempleo juvenil, las brechas de #género y de habilidades tanto técnicas como blandas. Consulta el #AnuarioCorresponsables2019 para más información. 👉https://t.co/0Q35KVePYi"
174,2020-07-16,,,,"@martinruggiero3 @Lulumensajes @MartinVizcarraC @MTPE_Peru Señor Ministro, elimine las trabas burocráticas para crear empleo formal, abarátenla carga laboral. El Perú requiere una inversión y empleo Formal para salir de la crisis."
175,2020-07-16,,,,"@mig131160 @ProfesorDurand ? El 70% de la economía es informal es hora de cambiar eso y fomentar más empleo e inversiones. Perú tiene el sobrecosto laboral más alto de alianza del Pacífico, y las trabas que te pone las municipalidades sumado al tiempo de trámites tiene que cambiar"
176,2020-07-16,,,,"Empleo: Políticas laborales deberán beneficiar a la microempresa para recuperar puestos de trabajo 
https://t.co/A6N8m3HVFL"
177,2020-07-16,,,,Vamos Peru https://t.co/mKJzlYn698
178,2020-07-16,,,,"#WebinarEGPP  
📹 Conoce la opinión de especialistas en el rubro sobre los principales retos de la Reforma del empleo público en el Perú, en el siguiente video.
Participan: @jjmartinezortiz, @mercedesiaco, Juan Carlos Cortazar, Raúl Gutierrez y @gmromerol
https://t.co/qLDkjZAF3O"
179,2020-07-16,,,,"Conoce mayores alcances del Convenio G2G entre el Perú y el Reino Unido, que impulsará la reconstrucción tan esperada y sobre todo la generación de empleo en las regiones del país.

Participen ingresando al siguiente enlace: https://t.co/0Sy6RgiEH9 https://t.co/eajQJzsKh0"
180,2020-07-16,,,,"@exitosape Sra.Ministra no trabaja para todos los peruanos? Las Mypes de Lambayeque estánmos sin capital de trabajo, no llega el FAE MYPE  ni REACTIVA PERU,la reactivación económica no se maneja de esa forma, las Mypes generamos mucho empleo digno y pagamos nuestros impuestos."
181,2020-07-16,,,,@PipoEc El problema con Perú también es que tienen una tasa de empleo no adecuado muy alto. La mayoría es informal entonces era casi imposible (socialmente) mantener una cuaretena muy restrictiva por mucho tiempo
182,2020-07-16,,,,"@CMP_PERU Oxal Ávalos, abogado laboralista: ""Prácticamente el 50% de los trabajadores de Lima Metropolitana ha perdido su empleo"" #AgendaPolíticaPyme https://t.co/sKUCWACKg7"
183,2020-07-16,,,,"@eloymarchan @peru21noticias @MTPE_Peru Si esta persona va a requerir de 20 asesores, por qué mejor no se empleó a una persona con mayor trayectoria profesional y con capacidad de decisión previa consulta."
184,2020-07-16,,,,"@OmarCairoRoldan Lamentable que esto ocurra cuando una pandemia global catastrófica urge al pais de políticas de empleo eficientes, justas, planeadas en base a la experiencia y al conocimiento profundo de la muy compleja y precaria realidad laboral en el Peru."
185,2020-07-16,,,,"#Internacionlal #Peru #America #COVID19  A pesar que en ese periodo ya transcurría la Fase 1 y 2 del reinicio de actividades, el empleo sigue siendo el indicador más afectado por la pandemia; se perdió más de la mitad del empleo de la capital https://t.co/uP8GcxfCik"
186,2020-07-16,,,,"@canalN_ Bueno ya sabemos quién es el padrino del Ministro Practicante. Esperemos equivocarnos, pero como siempre en el Perú, todo resulta peor de lo que se anticipa. Ojo que empleo cayó 55. 1% en Lima en último trimestre, dato @INEI_oficial"
187,2020-07-16,,,,"Empezamos bien! Necesitamos inversión privada, nacional y extranjera para generar riqueza. Solo generando riqueza salimos de la crisis. Y para ser atractivos necesitamos YA una reforma laboral. https://t.co/UsAMdLp6X0"
188,2020-07-16,,,,"@ferblog Mmmm!!!... Mucho pides !!

Su anti no lo deja ver el horizonte !!

El Peru está pagando un alto precio el anti:
Sangre, muertes, desempleo, hambre, miseria!!..."
189,2020-07-16,,,,"Fueron 2′699.100 personas las que dejaron de laborar en el segundo trimestre del año (abril-junio) respecto al mismo período del año pasado.

Mi nota de hoy.

https://t.co/FhGPePlmll vía @elcomercio_peru"
190,2020-07-16,,,,"Empleo en Lima: Se crearon 1,9 millones de puestos de trabajo en junio, pero aún hay 1,6 millones desempleados https://t.co/c3YeCSOiLj a través de @elcomercio_peru"
191,2020-07-16,,,,"practicante de marketing - diseñador gráfico, CONSULTORA CyL, #Lima, #Perú https://t.co/AxuuoYa9ls #Empleo"
192,2020-07-16,,,,"Jueves de Webinars. En esta ocasión, tocó revisar el Webinar de la @egobiernopucp sobre reforma del Empleo Público en el Perú. Imprescindibles reflexiones. https://t.co/adymPMp3Cq"
193,2020-07-16,,,,"La crisis de empleo es terrible, 2.6 millones de personas sin empleo en Lima. Nombramiento de Ministro de Trabajo es un insulto que traerá consecuencias.  https://t.co/Is8AJG5KfQ"
194,2020-07-16,,,,"Demasiado triste!
https://t.co/nqVDMuO3Bd"
195,2020-07-16,,,,"Colombia🇨🇴 y Perú🇵🇪 con tasas de cierre de empesas entre 41-50%, de las más altas entre las encuestadas en la región. Una alerta de la necesidad de protección al empleo y esquemas de seguridad social. #COVID19 https://t.co/89tPgBs4vL"
196,2020-07-16,,,,@PCaterianoB @MartinVizcarraC @pcmperu MUY BIEN PEDRO CAREIANO.FELICITACIONES. POR TU DESIGNACION DE PREMIARATO. SU EXPERIENCIA  POLITICA Y CONSTITUCIONALISTA .EL PERU NECESITA SU APORTE.PARA LOS PERUANOS.PARA ERRADICAR MAS CONTUNDENCIA .LA CORRUPCION.Y REACTIVACION ECONOMICA. MAS INVERSIONISTA.CREAR MAS EMPLEO.
197,2020-07-16,,,,"@elmorsa @dgrados @sandromarcone @ocram Me preocupa que el @MINPRODUCCION no cambie de equipo y se eleve al viceministro a calidad de ministro cuando ha sido un ministerio de la confusión en los últimos meses. Me preocupa que encargo está recibiendo el @MTPE_Peru, formalización o generación de empleo?"
198,2020-07-16,,,,@mlrvb @hugonopo @MTPE_Peru El Ministro debería dar una entrevista donde indique cuáles serán las políticas de corto y mediano plazo para enfrentar el desempleo y formalizar a los trabajadores. Hugo Ñopo ha planteado buenos temas para preguntarle al Ministro y veamos que tan bien preparado está.
199,2020-07-16,,,,"Empleo en Lima: Se crearon 1,9 millones de puestos de trabajo en junio, pero aún hay 1,6 millones desempleados 
https://t.co/kws9By57x9"
200,2020-07-16,,,,"@vozdelatierra @RPPNoticias @CONFIEP @MTPE_Peru @MinemPeru @MEF_Peru Que bueno activará el mercantilismo y genera empleo, que tiene de malo?"
201,2020-07-16,,,,"@jesusverdeL No sólo de Lima, también hay desempleo en Provincias, tiene que hacer esfuerzo  por solucionar lo que pasa en el Perú, dejemos el centralismo, los provincianos también importamos."
202,2020-07-16,,,,"Los científicos esperan que la aprobación de los órganos reguladores para el empleo masivo de la vacuna llegue ya ""en agosto o en septiembre"" https://t.co/6p4YXXsZMk"
203,2020-07-16,,,,"Una misma realidad, pero dos maneras de presentárnosla. 

1ra foto es parte de la portada de @elcomercio_peru

2da foto es parte de la portada de @Gestionpe

La pérdida de empleo de 2.7 millones de PERUANOS, NO mereció ser LA PORTADA PRINCIPAL de ninguno de los dos. https://t.co/m2WR1LxJDn"
204,2020-07-16,,,,"@vozdelatierra @MinemPeru @MTPE_Peru @MinamPeru @MEF_Peru Sr Arana, se necesita reactivar la economía, impulsar el empleo y se necesita -pese al gusto de la izquierda- de los empresarios. 
Pedro Cateriano lo sabe,y estoy segura de que hará un buen trabajo."
